{
  "url": "http://localhost:8000",
  "port": 8000,
  "hero": "<p class=\"mb-0\">A sample schema registry sandbox for testing purposes</p>",
  "action": {
    "title": "Star on GitHub",
    "url": "https://github.com/sourcemeta/registry",
    "icon": "github"
  },
  "pages": {
    "example": {
      "title": "Sourcemeta",
      "description": "My description",
      "email": "hello@sourcemeta.com",
      "github": "sourcemeta",
      "website": "https://www.sourcemeta.com"
    },
    "doc": {
      "title": "A sample schema folder",
      "description": "For testing purposes",
      "github": "sourcemeta/registry"
    }
  },
  "schemas": {
    "example/extension": {
      "base": "https://example.com/extension",
      "path": "./schemas/example/extension"
    },
    "example/schemas": {
      "base": "https://example.com/schemas",
      "path": "./schemas/example/folder",
      "defaultDialect": "http://json-schema.org/draft-07/schema#",
      "rebase": [
        { "from": "https://other.com", "to": "/example/bundling" }
      ]
    },
    "example/camelcase/test": {
      "base": "https://sourcemeta.com/camelcase",
      "path": "./schemas/example/camelcase"
    },
    "example/v2.0": {
      "base": "https://example.com/schemas",
      "path": "./schemas/example/v2.0"
    },
    "example/bundling": {
      "base": "https://example.com/bundling",
      "path": "./schemas/example/bundling"
    },
    "doc": {
      "base": "https://example.com/doc",
      "path": "./schemas/doc"
    },
    "hyper": {
      "base": "https://example.com/hyper",
      "path": "./schemas/hyper"
    }
  }
}
